alirezamsh/small100,lv,"Rosendale, a member of the hard-right Freedom Caucus, was one of the individuals who derailed the Wednesday votes. He views the top line number in Johnson's deal as being too high and as doing too little to cut the $34 trillion national debt.","Rosendale, greizsirdīgo brīvību Kaukusa loceklis, bija viens no indivīdiem, kas aizturēja trešdienas balsus. Viņš uzskata, ka Džonsona darījumu top līnijas numurs ir pārāk augsts un darīt pārāk maz, lai samazinātu $ 34 trilijonu valsts parādu.","Rozendeils, galēji labējo grupas Freedom Caucus dalībnieks, bija viens no tiem, kas apturēja trešdienas balsojumu. Viņaprāt, bruto summa Džonsona budžetā ir pārāk augsta, un tiek darīts pārāk maz, lai samazinātu valsts parādu 34 triljonu ASV dolāru apmērā."
alirezamsh/small100,lv,"South Wales four-piece The Now are proud to release their debut album, Too Hot To Handle, via True Music, and Callum joins me now. How are you doing, Callum? How's it going? Yeah, all good. Good, yourself? Yes, I'm very good. Thank you. It's a privilege to speak to yourselves because I've been listening to your music quite a lot since 2023. So I'm just loving the music, and I think it's something that we definitely need in the charts these days.","South Wales četras daļas The Now ir priecīgi izdalīt savu debitantu albumu, Too Hot To Handle, izmantojot True Music, un Callum pievienojas man tagad. Kā jūs darāt, Callum? Kā tas notiek? Jā, viss labi. Labs, jūs? Jā, es esmu ļoti labi. Paldies. Tas ir privilēģija runāt ar sevi, jo es esmu klausījies jūsu mūziku diezgan daudz kopš 2023. Tāpēc es tikai mīlu mūziku, un es domāju, ka tas ir kaut kas, ko mums noteikti nepieciešams šajās dienās diagrammās.","Dienvidvelsas grupa The Now, kurā ir četri dalībnieki, ar lepnumu izlaiž savu pirmo albumu Too Hot To Handle ierakstu studijā True Music, un tagad man pievienojas Kallums. Kā klājas, Kallum? Kā iet? Jā, viss labi. Labi, un tev? Jā, ļoti labi. Paldies. Runāt ar jums ir privilēģija, jo kopš 2023. gada es jūsu mūziku klausos diezgan bieži. Man vienkārši patīk šī mūzika, un, manuprāt, tai jābūt populārāko dziesmu sarakstā."
alirezamsh/small100,lv,"The results are in and, drum roll, please, it's completely consistent with my family history. 89.9% British and Irish with most of that concentrated in the scottish borders, western Ireland, Wales, and cornwall. It doesn't show much breton tho so either they're so close to cornish they don't show as different in me or my breton family wasn't originally from there.","Rezultāti ir un, bumbiņas rullis, lūdzu, tas ir pilnībā atbilst manu ģimenes vēsturi. 89.9% britu un Īrijas ar lielāko daļu, kas koncentrējas uz Skotijas robežas, Rietumeiropas Īrijas, Velsas un kukurūzas. Tas nerāda daudz bretona tho, tāpēc vai viņi ir tik blakus kukurūzas viņi nerāda, kā atšķirīgs man vai mana bretona ģimene nebija sākotnēji no turienes.","Rezultāti saņemti un, tadammmm, lūdzu - tie pilnībā atbilst manai ģimenes vēsturei. 89,9% briti un īri ar lielāko koncentrāciju pie Skotijas robežas, Īrijas rietumos, Velsā un Kornvolā. Tur nav daudz bretoņu, tāpēc, vai nu viņi ir tik tuvi kornvoliešiem, ka manī atšķirība vairs nav manāma, vai arī mani bretoņu priekšteči nebija no turienes."
alirezamsh/small100,lt,"However, Tenuk and Kayel quickly realized they weren't alone. A second dark creature shot out from beneath them, and Tenuk only just managed to avoid a collision.","Tačiau Tenuk ir Kayel greitai suprato, kad jie nėra vieni. Antrasis tamsios būtybės buvo nušautos iš po jų, o Tenukas tik sugebėjo išvengti susidūrimo.",Tačiau jau greitai Tenukas ir Kajelis suprato esą ne vieni. Jiems virš galvų išdygo dar viena tamsi būtybė ir Tenukui vos vos pavyko išvengti susidūrimo.
alirezamsh/small100,lt,"Tenuk hesitated, then stepped back, giving himself some space. With a low, slightly pained grunt, Tenuk's body stretched out, his fur replaced with scales and his arms replaced with wings. He quickly turned himself into a normal, light blue Thraki, but his eyes remained red.","Tenuk dvejodavo, tada žengė atgal, suteikdamas sau šiek tiek erdvę. Su žemu, šiek tiek skausminga grindų, Tenuk kūnas ištempė, jo plauka buvo pakeista skalėmis, o jo rankos buvo pakeistos sparnomis. Jis greitai pasikeitė į įprastą, šviesiai mėlyną Thraki, bet jo akys išliko raudonos.","Tenukas abejojo, tada atsitraukė, kad turėtų daugiau laisvos vietos. Lengvai, kiek skausmingai atsikrenkštęs Tenukas išsitiesė, jo kailis virto žvynais, o rankos – sparnais. Jis greit pavirto įprastu, žydru Trakiu, bet jo akių spalva išliko raudona."
alirezamsh/small100,lt,"They wondered if she would actually let them enter, unlike the previous times they went to ask. I still have a bruise from the last time. Ivory chuckled from the memory. Kari had thrown a book at their shoulder, but when she saw who it was, she apologized immediately.","Jie buvo įdomu, ar ji iš tikrųjų leistų jiems įeiti, skirtingai nuo ankstesnių kartų jie nuėjo paklausti. Aš vis dar turiu burną nuo paskutinio laiko. dramblys iškilo iš atminties. Kari išmetė knygą ant pečių, bet kai ji pamatė, kas tai buvo, ji nedelsiant atsiprašė.","Aivori svarstė, ar Kari įsileis vidun, nes anksčiau nepavykdavo įsiprašyti. „Vis dar turiu mėlynę iš ano karto“, – Aivori nusišypsojo prisiminusi. Kari metė knygą tiesiai Aivori į petį, bet atpažinusi, kam kliuvo, nedelsdama atsiprašė."
alirezamsh/small100,lt,"The ESP didn't go online immediately, let's give it a few minutes.","ESP nedelsiant eiti internete, leiskite jam keletą minučių.","ESP iškart neėsijungė, tad palaukime dar keletą minučių."
alirezamsh/small100,lt,"Ignacio Sánchez Recarte, secretary general of the Comité Européen des Entreprises Vins trade association representing some 7,000 wine producers across Europe, is dismissive of the concerns of the beer makers. He told Euronews that a market dominated by multinational brewing conglomerates bears no comparison with one comprised almost entirely of small, domestic producers.","Ignacio Sánchez Recarte, komiteto „Europeen des Entreprises Vins“ generalinis sekretorius, atstovaujančio maždaug 7 000 vyno gamintojų visoje Europoje, atsisakė alaus gamintojų susirūpinimų. „Euronews“ sakė, kad daugiašalių alaus gamybos konglomeratų dominuojanti rinka nėra palyginti su beveik visiškai mažų vietinių gamintojų.","Apie 7 000 Europos vyndarių vienijančios prekybos organizacijos „Comité Européen des Enterprises Vins“ generalinis sekretorius Ignacio Sánchez Recarte nesureikšmina aludarių reiškiamo susirūpinimo. Jis teigė „Euronews“, kad visiškai negalima lyginti daugybėje pasaulio valstybių veikiančių aludarystės konglomeratų dominuojamos rinkos su ta, kurioje veikia daugiausia smulkūs vietos gamintojai."
alirezamsh/small100,lt,@user4 @user3 @user5 @user6,@user4 @user3 @user5 @user6,@user4 @user3 @user5 @user6
alirezamsh/small100,lt,"Judging by the state of our hospitals, the SNP's talk of recovery plans and action plans is simply that - talk, and dangerous talk at that. We must not allow incompetent politicians to lull us into complicity in the demise of that great British institution, the National Health Service.","Sprendžiant pagal mūsų ligoninių valstybę, SNP kalba apie atkūrimo planus ir veiksmų planus yra tiesiog tai - kalbėti, ir pavojinga kalbėti apie tai. Mes neturime leisti nekompetentingų politikų apgauti mus į bendradarbiavimą dėl to didžiosios Britanijos institucijos, Nacionalinės sveikatos tarnybos, žlugimo.","Sprendžiant pagal mūsų vietos ligoninių būklę, SNP kalbos apie planus gerinti jų būklę lieka tik kalbos – bet ne tiesiog kalbos, o sunerimti verčiančios kalbos. Negalime leisti nekompetetingiems politikams mūsų užliūliuoti ir tiesiog žiūrėti, kaip žlunga didi britiška institucija – Nacionalinė sveikatos tarnyba."
alirezamsh/small100,lt,🚨 breaking news:,Nutraukiančios naujienos:,🚨 karščiausia naujiena:
alirezamsh/small100,lt,This song is encapsulates my predicament…,Ši daina apibūdina mano pranašumą...,"Ši daina puikiai atspindi sunkumus, su kuriais susiduriu..."
alirezamsh/small100,lt,Both the old and the new Listing titles call it a 12V 10W panel.,"Tiek senieji, tiek nauji sąrašų pavadinimai vadina jį 12V 10W plokšteliu.","Tiek senuosiuose, tiek dabartiniuose sąrašuose jis vadinama 12 V 10 W skydeliu."
alirezamsh/small100,lt,"Isn’t that funny? We have half the manpower left, and we can’t even refrain from hurting one another. I hastily sped up, Al’s was around the corner, so I would be fine inside. A glance behind me ensured that I was no longer being tailed as I stood in front of a bright glowing sign that read, “Alborn’s Pawnshop!” With slower steps, I entered once again–this place was more under the cover, as Alborn would often take in people who’d been mutated and snuck into Paltricus. Upon opening the door, the lights had been shut off, interestingly enough–there was no Al. No refugees. Nothing. Something wasn’t right here.","Ar ne taip juokinga? Mes turime pusę žmogiškosios jėgos paliko, ir mes net negalime susilaikyti nuo pakenkimo vienas kitam. Aš skubiai pakilo, Al's buvo aplink kampą, todėl aš būčiau gražus viduje. Žvilgsnis už mane užtikrino, kad aš nebebuvau maišytu, nes aš stovėjau priešais ryškią šviesią ženklą, kuris skaito: ""Alborn's Pawnshop!"" Su lėtesniais žingsniais, aš vėl įžengiau – ši vieta buvo daugiau pagal dangtelį, nes Alborn dažnai imtų žmonių, kurie buvo nukreiptas ir į Paltricus. atidarius duris, šviesos buvo išjungtos, įdomiai pakankamai – nebuvo Al. Nėra pabėgėlių. Niekas. Čia nebuvo teisinga.","Argi nejuokinga? Mums liko pusė pajėgumų ir negalime susilaikyti vienas kito nežaloję. Aš paspartinau žingsnį, Alas jau lūkūriavo už kampo, tad viduje būsiu saugi. Pažvelgusi atgal įsitikinau, kad manęs nebeseka, o aš stovėjau prieš ryškiai šviečiantį ženklą „Alborno lombardas!“. Eidama lėčiau, užėjau dar kartą. Vieta atrodė slaptesnė, nes Albornas neretai priimdavo mutavusius ir į Paltriką įsmukusius žmones. Peržengus duris, lempos užgeso, ir, keista, bet Alo nebuvo. Jokių pabėgėlių. Nė vieno. Kažkas buvo ne taip."
alirezamsh/small100,lt,These good quality stickers are about 50p each. They'll cost the same again to post. And way more in my own time to individually package and send them.,Šie geros kokybės lipdukai yra apie 50p kiekvienas. Jie kainuos tą patį vėl siųsti. Ir daug daugiau savo laiku individualiai pakuoti ir siųsti juos.,"Vienas šių geros kokybės lipdukų kainuoja maždaug 50 pensų. Panašiai tiek pat kainuos ir jų siuntimas paštu. O daug brangiau kainuos mano laikas, kurio prireiks kiekvieną jų atskirai supakuoti ir išsiųsti."
alirezamsh/small100,lt,So the challenges in this are already showing themselves. I'm likely going to have a VERY difficult time getting a medical clearance due to the FAA's stance on certain medications.,"Taigi, šioje srityje iššūkiai jau rodo save. Aš tikriausiai turėsiu labai sunkią laiką gauti medicininį išsilavinimą dėl FAA pozicijos dėl tam tikrų vaistų.","Taigi, akivaizdu, kad su tuo susiję sunkumai yra akivaizdūs. Dėl FAA pozicijos dėl tam tikrų vaistų man tikriausiai bus LABAI sunku gauti leidimą skraidyti."
alirezamsh/small100,lt,And just under the wire basically someone actually beat Trimming the Herbs! Really impressive.,Ir tik po laido iš esmės kažkas iš tikrųjų nugalėjo Pjaustymas Žolelių! tikrai įspūdingas.,Ir po žaidimo kažkam tikrai pavyko įveikti „Trimming the Herbs“! Neįtikėtina.
alirezamsh/small100,lt,Yea so I flew this today.,"Taip, aš šiandien skraidiau.","Taip, taigi aš skridau šiandien."
alirezamsh/small100,lt,"So my dad can't give me rides to work. And for me, work is about 27 miles away. So there and back would be nearly a $100 a day with Uber. I haven't looked at Lyft. I could have, I guess, that makes sense. But I didn't have rental on my auto insurance, so that's my fault. So I guess I could have tried to do that and get that set up and tried to get a rental while I was down and out of a car. But even then, a rental wouldn't cover seven days. I'm going to sneeze, hold on. That sneeze sucked.","Taigi mano tėvas negali man duoti važiavimų dirbti. Ir man, darbas yra apie 27 mylių atstumu. Taigi ten ir atgal būtų beveik 100 $ per dieną su ""Uber"". Aš nežiūrėjau į ""Lyft"". Aš galėjau turėti, manau, kad tai yra prasminga. Bet aš neturėjau nuomos dėl mano automobilių draudimo, todėl tai yra mano kaltė. Taigi manau, aš galėjau pabandyti tai padaryti ir gauti tai nustatytą ir bandė gauti nuomos, o aš buvau žemyn ir iš automobilio. Bet net tada, nuoma nebūtų apimti septynias dienas. Aš eisiu sniegas, laikykis. Tai sniegas sugriežtas.","Tai va, mano tėtis negali pametėti manęs iki darbo, o man iki darbo nuo namų reikia važiuoti apie 27 mylias. Todėl kelionė pirmyn ir atgal su „Uber“ man kasdien kainuotų apie 100 dolerių. Nežiūrėjau, ką siūlo „Lyft“, nors galėjau turbūt, tame yra racijos. Bet mano draudimas neapėmė nuomos, tad čia jau mano kaltė. Tad gal ir galėjau bandyti įtraukti nuomą kol neturėjau mašinos, bet ir tokiu atveju nuoma neapima septynių dienų. Palauk, čiaudėsiu. Ne koks čiaudulys buvo."
alirezamsh/small100,lt,Saturday Cont:,Šeštadienio sąskaita:,Sekmadienio tęsinys:
alirezamsh/small100,lt,"Rosendale, a member of the hard-right Freedom Caucus, was one of the individuals who derailed the Wednesday votes. He views the top line number in Johnson's deal as being too high and as doing too little to cut the $34 trillion national debt.","Rosendale, griežtai dešinysis Freedom Caucus narys, buvo vienas iš asmenų, kurie sustabdė trečiadienio balsus. Jis mano, kad Johnson'o sandorio viršutinio eilutės numeris yra per didelis ir daro per mažai, kad sumažintų 34 trilijonų JAV dolerių nacionalinę skolą.","Griežtos linijos dešiniųjų „Freedom Caucus“ narys M. Rosendale‘as buvo vienas tų, kurie sužlugdė trečiadienio balsavimą. Anot jo, didžiausias skaičius M. Johnsono siūlyme yra per didelis ir niekaip neprisideda prie pastangų sumažinti 34 trilijonų dolerių valstybės skolą."
alirezamsh/small100,lt,"South Wales four-piece The Now are proud to release their debut album, Too Hot To Handle, via True Music, and Callum joins me now. How are you doing, Callum? How's it going? Yeah, all good. Good, yourself? Yes, I'm very good. Thank you. It's a privilege to speak to yourselves because I've been listening to your music quite a lot since 2023. So I'm just loving the music, and I think it's something that we definitely need in the charts these days.","Pietų Velso keturi daliniai „The Now“ didžiuojasi išleisti savo debiutinį albumą „Too Hot To Handle“, per True Music, ir „Callum“ prisijungia prie manęs dabar. Kaip jūs darote, „Callum“? Kaip tai vyksta? Taip, viskas gerai. Gerai, sau? Taip, aš esu labai gera. Ačiū. Tai privilegija kalbėti su savimi, nes aš klausiu jūsų muzikos gana daug nuo 2023. Taigi aš tiesiog myliu muziką, ir manau, kad tai yra kažkas, ko mums tikrai reikia šiomis dienomis diagramoje.","Iš Pietų Velso kilusi ketveriukė „The Now“ su pasididžiavimu pristato savo debiutinį albumą „Too Hot To Handle“, kurį išleido „True Music“, ir dabar aš kalbuosi su Callum. Kaip einasi, Callum? Gerai. Gerai, o tau? Irgi gerai. Ačiū. Man nemenka garbė kalbėti su jumis, nuo 2023 m. klausau gan daug jūsų muzikos. Ji man tikrai patinka ir manau, kad muzikos topuose šiandien mums reikia būtent tokios muzikos."
alirezamsh/small100,lt,"The results are in and, drum roll, please, it's completely consistent with my family history. 89.9% British and Irish with most of that concentrated in the scottish borders, western Ireland, Wales, and cornwall. It doesn't show much breton tho so either they're so close to cornish they don't show as different in me or my breton family wasn't originally from there.","Rezultatai yra ir, dramblio ritulys, prašome, tai visiškai suderinama su mano šeimos istorija. 89.9% britų ir airių su daugiausia susikoncentruota Škotijos sienų, Vakarų Airijos, Velso ir kukurūzų sienos. Tai neparodo daug bretonų tho, todėl arba jie yra tokie arti kukurūzų jie neatrodo, kaip skiriasi man ar mano bretonų šeima nebuvo iš pradžių iš ten.","Gauti rezultatai, ir leiskite pasakyti, kad jie puikiai atitinka mano šeimos istoriją. 89,9 % britų ir airių, dauguma jų gyvena Kornvalyje, Velse, Škotijos pasienyje ir Vakarų Airijoje. Tačiau nerodo jokių bretonų, taigi arba mano bretonų šeima nebuvo kilusi iš ten, arba jie tokie panašūs į kornišus, kad jie net nėra išskiriami."
alirezamsh/small100,pl,"However, Tenuk and Kayel quickly realized they weren't alone. A second dark creature shot out from beneath them, and Tenuk only just managed to avoid a collision.","Jednak Tenuk i Kayel szybko zdają sobie sprawę, że nie są sami. Druga ciemna istota wystrzelona z pod nimi, a Tenuk po prostu udało się uniknąć zderzenia.","Aczkolwiek Tenuk i Kayel błyskawicznie uzmysłowili sobie, że nie są tam sami. Kolejne mroczne stworzenie wystrzeliło w górę spod nich, a Tenuk ledwie zdołał uniknąć zderzenia."
alirezamsh/small100,pl,"Tenuk hesitated, then stepped back, giving himself some space. With a low, slightly pained grunt, Tenuk's body stretched out, his fur replaced with scales and his arms replaced with wings. He quickly turned himself into a normal, light blue Thraki, but his eyes remained red.","Tenuk wahaniał się, następnie skrócił, dając sobie trochę miejsca.Z niskim, lekko bolesnym gruntem ciało Tenuk rozciągnęło się, jego włosy zastąpiono skalami, a ręce zastąpiono skrzydłami. Szybko zmienił się w normalny, światło niebieskie Thraki, ale jego oczy pozostały czerwone.","Tenuk zwlekał, a następnie odsunął się, robiąc sobie więcej miejsca. Wydał słabe, trochę bolesne jękniecie, a jego ciało wyciągnęło się, sierść przeobraziła się w łuski, a ramiona zamieniły się w skrzydła. Błyskawicznie przekształcił się w zwyczajnego, jasnoniebieskiego Thrakiego, ale jego oczy dalej były czerwone."
alirezamsh/small100,pl,"They wondered if she would actually let them enter, unlike the previous times they went to ask. I still have a bruise from the last time. Ivory chuckled from the memory. Kari had thrown a book at their shoulder, but when she saw who it was, she apologized immediately.","Zastanawiali się, czy w rzeczywistości pozwoli im wejść, w przeciwieństwie do poprzednich czasów, gdy poszli do pytań. Wciąż mam brąz z ostatniego czasu. Ivory zmarł z pamięci. Kari rzucił książkę na ramiona, ale kiedy zobaczyła, kto to jest, natychmiast przeprosiła.","Zachodziła w głowę, czy tym razem pozwoli jej wejść do komnaty, w odróżnieniu do poprzednich sytuacji, gdy o to pytała. Ciągle mam stłuczenie z ostatniego razu. Ivory zaśmiała się, przypominając o tym sobie. Kari cisnęła księgą w jej ramię, ale kiedy dostrzegła, w kogo rzuciła, od razu przeprosiła."
alirezamsh/small100,pl,"The ESP didn't go online immediately, let's give it a few minutes.","ESP nie wszedł w Internecie natychmiast, dajmy mu kilka minut.","Kamera ESP nie przeszła w tryb online od razu, poczekajmy kilka minut."
alirezamsh/small100,pl,"Ignacio Sánchez Recarte, secretary general of the Comité Européen des Entreprises Vins trade association representing some 7,000 wine producers across Europe, is dismissive of the concerns of the beer makers. He told Euronews that a market dominated by multinational brewing conglomerates bears no comparison with one comprised almost entirely of small, domestic producers.","Ignacio Sánchez Recarte, sekretarz generalny Komitetu Europejskiego ds. Przedsiębiorstw wina, który reprezentuje około 7000 producentów win w całej Europie, jest zwolniony z obaw producentów piwa. powiedział Euronews, że rynek dominowany przez wielonarodowe konglomeraty piwa nie jest w porównaniu z rynek składający się prawie w całości z małych krajowych producentów.","Ignacio Sanchez Recarte, sekretarz generalny stowarzyszenia handlowego Comite Europeen des Entrerprises Vins, które reprezentuje około 7000 producentów win w Europie, nie podziela obaw piwowarów. Powiedział Euronews, że rynek zdominowany przez międzynarodowe koncerny piwowarskie nie stanowi porównania z pojedynczym rynkiem składającym się praktycznie w całości z małych, lokalnych producentów."
alirezamsh/small100,pl,@user4 @user3 @user5 @user6,@user4 @user3 @user5 @user6,@user4 @user3 @user5 @user6
alirezamsh/small100,pl,"Judging by the state of our hospitals, the SNP's talk of recovery plans and action plans is simply that - talk, and dangerous talk at that. We must not allow incompetent politicians to lull us into complicity in the demise of that great British institution, the National Health Service.","Sądząc przez stan naszych szpitali, mówienie SNP o planach odzyskiwania i planach działania jest po prostu to - mówienie, i niebezpieczne mówienie o tym. Nie powinniśmy pozwolić niekompetentnym politycznym, aby nas oszukali w współczucie w zniesieniu tej wielkiej brytyjskiej instytucji, Narodowej służby zdrowia.","Oceniając po stanie naszych szpitali, informacje SNP o planach naprawczych i planach działania jest po prostu gadaniem i do tego niebezpiecznym gadaniem. Nie możemy pozwolić, aby niekompetentni politycy wciągnęli nas do współudziału w upadku tej wspaniałej brytyjskiej instytucji – publicznej służby zdrowia."
alirezamsh/small100,pl,🚨 breaking news:,Przerwanie wiadomości:,🚨 informacje z ostatniej chwili:
alirezamsh/small100,pl,This song is encapsulates my predicament…,Ta piosenka jest włączona do moich przedmiotów...,Ta piosenka podsumowuje moje trudne położenie…
alirezamsh/small100,pl,Both the old and the new Listing titles call it a 12V 10W panel.,"Zarówno stare, jak i nowe tytuły Listing nazywają go panelem 12V 10W.","Obie nazwy specyfikacji, stara i nowa, określają go jako panel 12 V 10 W."
alirezamsh/small100,pl,"Isn’t that funny? We have half the manpower left, and we can’t even refrain from hurting one another. I hastily sped up, Al’s was around the corner, so I would be fine inside. A glance behind me ensured that I was no longer being tailed as I stood in front of a bright glowing sign that read, “Alborn’s Pawnshop!” With slower steps, I entered once again–this place was more under the cover, as Alborn would often take in people who’d been mutated and snuck into Paltricus. Upon opening the door, the lights had been shut off, interestingly enough–there was no Al. No refugees. Nothing. Something wasn’t right here.","Czyż nie jest to śmieszne?Mamy połowa siły ludzkiej i nie możemy nawet powstrzymać się od obrażenia nawzajem. Szybko pospieszyłem się, Al był wokół rogu, więc byłem dobrze wewnątrz. Spojrzenie za mną zapewniło, że nie jestem już obrzucany, gdy stoję przed jasnym błyszczącym znakiem, który czyta: „Alborn’s Pawnshop!” Z wolniejszymi krokami wkroczyłem ponownie – to miejsce było bardziej pod pokrywką, ponieważ Alborn często wziąłby w ludzi, którzy byli zmutowani i prześladowani do Paltricus. Po otwarciu drzwi, światła zostały wyłączone, ciekawie wystarczająco – nie było Al. Nie było żadnych uchodźców. Nic. Nie było tutaj.","Czyż to nie jest śmieszne? Dysponujemy tylko połową zasobów ludzkich i nie potrafimy nawet zaniechać wyrządzania sobie krzywdy. Bezzwłocznie przyspieszyłam kroku, lokal Ala znajdował się za zakrętem, a wewnątrz będę bezpieczna. Obejrzawszy się za siebie, uświadomiłam sobie, że nikt już za mną nie idzie. Stałam przed rozświetlonym szyldem, na którym widniał napis: „Lombard Alborna!”. Idąc już wolniej, weszłam do środka ponownie – ten lokal dział raczej pod przykrywką, gdyż Alborn regularnie gościł ludzi po przejściu mutacji, którzy przekradli się na teren Paltricusa. Jak tylko otworzyłam drzwi, światła zgasły, co ciekawe – Ala tam nie było. Zero uchodźców. Nikogo. Wydarzyło się tu coś niedobrego."
alirezamsh/small100,pl,These good quality stickers are about 50p each. They'll cost the same again to post. And way more in my own time to individually package and send them.,"Te wysokiej jakości naklejki są około 50p każdy. Będą kosztować to samo ponownie, aby wysyłać. I jeszcze bardziej w moim własnym czasie, aby indywidualnie opakować i wysyłać je.","Te dobre jakościowo naklejki kosztują jakieś 50 pensów za sztukę. Wysyłka pocztą będzie kosztować tyle samo. I o wiele więcej, jeśli chodzi o nakład mojego własnego czasu, aby po kolei je zapakować i wysłać."
alirezamsh/small100,pl,So the challenges in this are already showing themselves. I'm likely going to have a VERY difficult time getting a medical clearance due to the FAA's stance on certain medications.,"Tak więc wyzwania w tym już pokazują się.Prawdopodobnie będę miał bardzo trudny czas, aby uzyskać lekarstwo z powodu stanowiska FAA w sprawie niektórych leków.",Zatem wyzwania w tym zakresie już się ukazują. Prawdopodobnie będę miała BARDZO ciężką przeprawę z uzyskaniem zaświadczenia lekarskiego ze względu na stanowisko FAA w sprawie niektórych leków.
