alirezamsh/small100,hu,"The ESP didn't go online immediately, let's give it a few minutes.","Az ESP nem ment azonnal online, adjunk néhány percet.","Az ESP nem találta meg azonnal a netet, adok neki pár percet."
alirezamsh/small100,hu,"Ignacio Sánchez Recarte, secretary general of the Comité Européen des Entreprises Vins trade association representing some 7,000 wine producers across Europe, is dismissive of the concerns of the beer makers. He told Euronews that a market dominated by multinational brewing conglomerates bears no comparison with one comprised almost entirely of small, domestic producers.","Ignacio Sánchez Recarte, a Bizottság Europeen des Entreprises Vins kereskedelmi szövetségének főtitkára, amely Európában mintegy 7000 bortermelőt képvisel, elutasítja a sörgyártók aggodalmát.","Ignacio Sánchez Recarte, az európai szinten 7000 borászt képviselő Comité Européen des Enterprises Vins szakmai szövetség főtitkára visszautasította a sörgyártók aggodalmait. Az Euronewsnak adott nyilatkozata szerint nem lehet összehasonlítani a két piacot: az egyiken multinacionális sörgyártó vállalatcsoportok dominálnak, míg a másikon szinte csak kisebb, belföldi termelők vannak jelen."
alirezamsh/small100,hu,@user4 @user3 @user5 @user6,@user4 @user3 @user5 @user6,@user4 @user3 @user5 @user6
alirezamsh/small100,hu,"Judging by the state of our hospitals, the SNP's talk of recovery plans and action plans is simply that - talk, and dangerous talk at that. We must not allow incompetent politicians to lull us into complicity in the demise of that great British institution, the National Health Service.","Kórházunk állapota alapján ítélve az SNP beszédét a helyreállítási tervekről és cselekvési tervekről egyszerűen azt jelenti - beszélni, és veszélyes beszélni róla.","Ha a kórházaink állapotát nézzük, megállapíthatjuk, hogy amikor az SNP helyreállítási tervekről és intézkedési csomagokról beszél, az csupán üres beszéd, ráadásul annak egy igen veszélyes vállfaja. Nem szabad hagynunk, hogy hozzá nem értő politikusaink minket is bűnrészessé tegyenek a nagymúltú brit intézmény, a nemzeti egészségügyi szolgálat tönkretételében."
alirezamsh/small100,hu,🚨 breaking news:,Breaking News:,🚨 rendkívüli híreink:
alirezamsh/small100,hu,This song is encapsulates my predicament…,Ez a dal kapszulálja az előadóm...,Ez a dal leírja a kutyaszorítómat…
alirezamsh/small100,hu,Both the old and the new Listing titles call it a 12V 10W panel.,"Mind a régi, mind az új listázási címek 12V 10W panelnek nevezik.","A régi és az új terméklapon egyaránt 12 V-os, 10 W-os panelként van feltüntetve."
alirezamsh/small100,hu,"Isn’t that funny? We have half the manpower left, and we can’t even refrain from hurting one another. I hastily sped up, Al’s was around the corner, so I would be fine inside. A glance behind me ensured that I was no longer being tailed as I stood in front of a bright glowing sign that read, “Alborn’s Pawnshop!” With slower steps, I entered once again–this place was more under the cover, as Alborn would often take in people who’d been mutated and snuck into Paltricus. Upon opening the door, the lights had been shut off, interestingly enough–there was no Al. No refugees. Nothing. Something wasn’t right here.","Nem ez vicces? Fele emberségünk van hátra, és még nem tudunk elkerülni egymástól. Gyorsan felgyorsultam, Al a sarokban volt, így finom lenne belé. Egy pillantás mögöttem biztosította, hogy nem voltam többé vágva, amikor egy fényes ragyogó jel előtt álltam, amely olvasható: „Alborn’s Pawnshop!” Lassabb lépésekkel ismét beléptem – ez a hely sokkal alattiabb volt a fedél alatt, mivel Alborn gyakran el fogja venni az embereket, akik mutáltak és a Paltricusba süllyedtek. Amikor kinyitották az ajtót, a fények kikapcsolódtak, érdekesen elég volt – nem volt Al. Nincs menekültek. Semmi. Itt valami nem volt helyes.","Hát nem vicces? Már csak az emberek fele maradt meg, de még így sem bírjuk ki, hogy ne bántsuk egymást. Elkezdtem gyorsabban szedni a lábaimat, Al zálogháza a sarkon volt, ott bent már biztonságban leszek. Egy gyors pillantást vetettem még a hátam mögé, hogy megbizonyosodjak arról, hogy már nem követnek, amikor egy fényesen világító tábla előtt megálltam, amelyen az állt, hogy „Alborn zálogháza!”. Már lassabb tempóval léptem be – amolyan titkos kis hely volt, mivel Alborn gyakran fogadott be ide mutálódottakat, és becsempészte őket Paltricusba. Ahogy kinyitottam az ajtót, érdekes módon a lámpák le voltak kapcsolva... Al sehol, menekültek sehol. Semmi. Itt bizony valami nem stimmel."
alirezamsh/small100,hu,These good quality stickers are about 50p each. They'll cost the same again to post. And way more in my own time to individually package and send them.,"Ezek a jó minőségű matricák körülbelül 50p minden. Ők költsége ugyanazt újra, hogy küldjön. És még inkább a saját időm, hogy egyénileg csomagolni és elküldeni őket.","Ezeknek a jó minőségű matricáknak a darabja kb. 50 penny. Ugyanennyi a postaköltség. És még több idő, hogy egyesével becsomagoljam és feladjam."
alirezamsh/small100,hu,So the challenges in this are already showing themselves. I'm likely going to have a VERY difficult time getting a medical clearance due to the FAA's stance on certain medications.,Tehát a kihívások már megmutatják magukat. valószínűleg nagyon nehéz lesz az orvosi tisztítás megszerzése miatt az FAA bizonyos gyógyszerekre vonatkozó álláspontja miatt.,Már szembesültem is néhány kihívással. Valószínűleg NAGYON nehéz lesz orvosi igazolást szereznem az FAA bizonyos gyógyszerekkel kapcsolatos álláspontja miatt.
alirezamsh/small100,hu,And just under the wire basically someone actually beat Trimming the Herbs! Really impressive.,És csak a vezeték alatt alapvetően valaki tényleg megcsinálta vágás a gyógynövények! Valóban lenyűgöző.,És időközben valakinek sikerült megcsinálni A növények metszése pályát! Lenyűgöző.
alirezamsh/small100,hu,Yea so I flew this today.,Ilyenkor ma repültem.,"Igen, ma ezzel repültem."
alirezamsh/small100,hu,"So my dad can't give me rides to work. And for me, work is about 27 miles away. So there and back would be nearly a $100 a day with Uber. I haven't looked at Lyft. I could have, I guess, that makes sense. But I didn't have rental on my auto insurance, so that's my fault. So I guess I could have tried to do that and get that set up and tried to get a rental while I was down and out of a car. But even then, a rental wouldn't cover seven days. I'm going to sneeze, hold on. That sneeze sucked.","Tehát apa nem adhat nekem járatokat dolgozni. És számomra, a munka körülbelül 27 mérföldre van. Tehát ott és vissza lenne majdnem 100 dollár egy nap az Uber-vel. Nem néztem a Lyft-t. Lehet, hogy, azt hiszem, hogy van értelme. De nem volt bérleti autóbiztosítás, így ez az én hibám. Tehát azt hiszem, megpróbáltam megtenni, és ezt beállítani, és megpróbáltam bérelni, miközben lefelé és kijöttem az autóba. De még akkor is, egy bérleti nem fedezne le hét napot.","Szóval apukám nem tud elvinni a munkahelyemre. És az én munkahelyem körülbelül 27 mérföldre van. Azaz oda-vissza közel 100 dollár lenne naponta Uberrel. A Lyftet még nem néztem meg. Megnézhetném, azt hiszem, lenne értelme. De az autóbiztosításom nem tartalmazza a bérlést, ez az én hibám. Szóval azt hiszem, meg kellett volna próbálnom azt, és el kellett volna intéznem, és szereznem kellett volna egy bérautót, amíg nem dolgoztam és nem volt kocsim. De még ebben az esetben sem fedezett volna a bérlés hét napot. Tüsszentenem kell, várj. Ez a tüsszentés szívás volt."
alirezamsh/small100,hu,Saturday Cont:,A szombati számlát:,Szombat folyt.:
alirezamsh/small100,hu,"Rosendale, a member of the hard-right Freedom Caucus, was one of the individuals who derailed the Wednesday votes. He views the top line number in Johnson's deal as being too high and as doing too little to cut the $34 trillion national debt.","Rosendale, a kemény jobboldali Freedom Caucus tagja volt az egyik olyan személy, aki elutasította a szerdai szavazatokat. Johnson megállapodás felső sorszámát úgy látja, hogy túl magas, és túl kevés, hogy csökkentse a 34 billió dollár nemzeti adósságot.","Rosendale, a szélsőjobboldali Freedom Caucus egyik olyan tagja volt, aki kisiklatta a szerdai szavazásokat. Szerinte a Johnson ajánlatában szereplő legmagasabb számok túl magasak, és egyáltalán nem elegendők a 34 billió dolláros államadósság csökkentéséhez."
alirezamsh/small100,hu,"South Wales four-piece The Now are proud to release their debut album, Too Hot To Handle, via True Music, and Callum joins me now. How are you doing, Callum? How's it going? Yeah, all good. Good, yourself? Yes, I'm very good. Thank you. It's a privilege to speak to yourselves because I've been listening to your music quite a lot since 2023. So I'm just loving the music, and I think it's something that we definitely need in the charts these days.","South Wales négy darab The Now büszke arra, hogy megjelent debütált albumjuk, Too Hot To Handle, True Music keresztül, és Callum csatlakozik hozzám most. Hogyan csinálsz, Callum? Hogyan megy? Igen, minden jó. Jó, önmagad? Igen, nagyon jó vagyok. Köszönöm. Ez kiváltság, hogy beszélsz magaddal, mert 2023 óta nagyon sokat hallgatom a zenét, és azt hiszem, hogy ez valami, amit biztosan szükségünk van a grafikonokban ezekben a napokban.","A dél-wales-i, négytagú The Now büszkén mutatja be debütáló albumát Too Hot to Handle címmel, a True Musictól, és most Callum csatlakozik hozzám. Hogy vagy, Callum? Mi a helyzet? Igen, minden oké. Jó, és te? Igen, nagyon jól vagyok. Köszönöm. Megtiszteltetés beszélgetni veletek, mert 2023 óta elég sokat hallgattam a zenéteket. Szóval szeretem a zenét, és azt hiszem, ez olyan zene, amire manapság határozottan szükségünk van a slágerlistákon."
alirezamsh/small100,hu,"The results are in and, drum roll, please, it's completely consistent with my family history. 89.9% British and Irish with most of that concentrated in the scottish borders, western Ireland, Wales, and cornwall. It doesn't show much breton tho so either they're so close to cornish they don't show as different in me or my breton family wasn't originally from there.","Az eredmények vannak, és, drum roll, kérem, ez teljesen összhangban a családi történelem. 89.9% brit és ír, a legtöbb, hogy összpontosítva a skót határ, nyugat-Írország, Wales, és a kukorica fal. Ez nem mutat sok breton tho, így akár annyira közel a kukorica nem tűnik, mint különbözik én vagy a breton családom nem volt eredetileg ott.","Az eredmények megérkeztek, és – dobpergés! – tökéletesen alátámasztják a családom történetét. 89,9%-ban brit és ír, többnyire a skót határvidék, Írország nyugati része, Wales és Cornwall környékéről. Az viszont nem látszik, mekkora a breton rész, vagy azért, mert annyira közel vannak a cornwalliakhoz, hogy nem jelennek meg külön vonalként bennem, vagy, mert a családom breton ága nem onnan származik."
alirezamsh/small100,is,"However, Tenuk and Kayel quickly realized they weren't alone. A second dark creature shot out from beneath them, and Tenuk only just managed to avoid a collision.","Hins vegar áttaðu Tenuk og Kayel fljótt að þeir voru ekki einn. Annað myrkur verur skotinn út undir þeim, og Tenuk bara tókst að forðast kollision.",Hins vegar uppgötvuðu Tenuk og Kayel skjótt að þeir voru ekki einir á ferð. Önnur dökk skepna skaust út úr skóginum fyrir neðan þá og Tenuk tókst rétt svo að forðast árekstur við hana.
alirezamsh/small100,is,"Tenuk hesitated, then stepped back, giving himself some space. With a low, slightly pained grunt, Tenuk's body stretched out, his fur replaced with scales and his arms replaced with wings. He quickly turned himself into a normal, light blue Thraki, but his eyes remained red.","Tenuk hvarf, þá skref aftur, gefi sér sér pláss. Með lágum, svolítið sársaukaður grunt, líkaminn Tenuk stækka út, fúr hans skiptast með stigi og hendur hans skiptast með vingar. Hann snúast fljótt í venjuleg, létt blá Thraki, en augu hans voru rauð.","Tenuk hikaði andartak, tók síðan tvö skref aftur á bak til að gefa sjálfum sér eilítið pláss. Hann gaf frá sér lága erfiðisstunu og svo tók líkami hans að lengjast. Feldurinn hans vék fyrir hreistri og hendur hans umbreyttust í vængi. Hann breytti sér snarlega í ljósbláan þraka. Bara augun, sem voru ennþá rauð, stungu í stúf."
alirezamsh/small100,is,"They wondered if she would actually let them enter, unlike the previous times they went to ask. I still have a bruise from the last time. Ivory chuckled from the memory. Kari had thrown a book at their shoulder, but when she saw who it was, she apologized immediately.","Þeir spyrja hvort hún myndi í raun leyfa þeim að komast inn, ólíkt fyrri sinnum sem þeir fóru að spyrja. Ég hef enn brúss frá síðasta sinn. Ivory flutt frá minningum. Kari hafði kastað bók á öxl þeirra, en þegar hún sá hver það var, sagði hún strax afsökun.","Ivory velti fyrir sér hvort stúlkan myndi opna í þetta sinn, ólíkt því sem áður var. Ég er ennþá með marbletti frá því síðast, hugsaði Ivory og brosti við minninguna. Kari hafði hent bók sem hitti Ivory í öxlina, en hún hafði beðist afsökunar um leið og hún sá hver var þar á ferð."
alirezamsh/small100,is,"The ESP didn't go online immediately, let's give it a few minutes.","ESP fór ekki á netinu strax, skulum gefa það nokkrar mínútur.","ESP-myndavélin tengdist ekki netinu alveg um leið, gefum þessu nokkrar mínútur."
alirezamsh/small100,is,"Ignacio Sánchez Recarte, secretary general of the Comité Européen des Entreprises Vins trade association representing some 7,000 wine producers across Europe, is dismissive of the concerns of the beer makers. He told Euronews that a market dominated by multinational brewing conglomerates bears no comparison with one comprised almost entirely of small, domestic producers.","Ignacio Sánchez Recarte, framkvæmdastjóri Komité Européen des Entreprises Vins viðskiptasambandsins sem táknar um 7.000 vínframleiðendur í Evrópu, er ógnvekjandi um áhyggjur af bjórframleiðendum. Hann sagði Euronews að markaðssetning sem er stjórnað af fjölþjóðlegum bjórkonum er ekki samanburður við einn sem samanstendur nánast alveg af litlum innlendum framleiðendum.","Ignacio Sánchez Recarte, aðalritari atvinnugreinasambandsins Comité Européen des Entreprises Vins, sem fer fyrir um 7000 evrópskum vínframleiðendum, gefur lítið fyrir áhyggjur bjórframleiðenda. Hann sagði við fréttamiðilinn Euronews að markaður sem stýrt er af alþjóðlegum bruggsamsteypum eigi ekkert sameiginlegt með markaði sem samanstendur næstum alfarið af litlum, innlendum framleiðendum."
alirezamsh/small100,is,@user4 @user3 @user5 @user6,@user4 @user3 @user5 @user6,@user4 @user3 @user5 @user6
alirezamsh/small100,is,"Judging by the state of our hospitals, the SNP's talk of recovery plans and action plans is simply that - talk, and dangerous talk at that. We must not allow incompetent politicians to lull us into complicity in the demise of that great British institution, the National Health Service.","Að dæma eftir ríki sjúkrahúsins okkar, tala SNP um endurvinnslu áætlanir og aðgerðaráætlanir er einfaldlega það - tala, og hættulegt tala um það.","Af stöðunni á spítölum okkar að dæma er ljóst að tal Skoska þjóðarflokksins um aðgerðaáætlanir og endurreisnaráætlanir er ekkert annað en nákvæmlega það: tal, og hættulegt tal ef út í það er farið. Við megum ekki leyfa óhæfum stjórnmálamönnum að fá okkur til að líta í hina áttina og gera okkur þannig meðsek í hruni mikilvægrar breskrar stofnunar á borð við NHS-heilbrigðiskerfi landsins."
alirezamsh/small100,is,🚨 breaking news:,brjóta fréttir:,🚨 nýjustu fréttir:
alirezamsh/small100,is,This song is encapsulates my predicament…,Þessar söngur er að bregðast við mig...,þetta lag nær fullkomlega utan um vandamálið mitt
alirezamsh/small100,is,Both the old and the new Listing titles call it a 12V 10W panel.,Bæði gamla og nýja Listing titlar kalla það 12V 10W panel.,Bæði gamla og nýja lýsingin segja að þetta sé 12 volta og 10 vatta sella.
alirezamsh/small100,is,"Isn’t that funny? We have half the manpower left, and we can’t even refrain from hurting one another. I hastily sped up, Al’s was around the corner, so I would be fine inside. A glance behind me ensured that I was no longer being tailed as I stood in front of a bright glowing sign that read, “Alborn’s Pawnshop!” With slower steps, I entered once again–this place was more under the cover, as Alborn would often take in people who’d been mutated and snuck into Paltricus. Upon opening the door, the lights had been shut off, interestingly enough–there was no Al. No refugees. Nothing. Something wasn’t right here.","Er það ekki skemmtilegt? Við höfum hálf mannvaldið eftir, og við getum ekki einu sinni haldið áfram að meiða hvert annað. Ég fljótt hratt upp, Al var í kringum horninn, svo ég myndi vera gott inni. A lítur á bak við mig tryggði að ég var ekki lengur beint eins og ég stóð fyrir framan björt glansandi merki sem las, ""Alborn's Pawnshop!"" Með hægri skrefum, ég kom aftur inn – þetta staður var meira undir flokkinn, eins og Alborn myndi oft taka í fólk sem hefði verið flutt og snúið inn í Paltricus. Eftir að opna dyrnar, ljósarnir höfðu verið lokað, áhugavert nóg – það var engin Al. Engin flóttamaður. Ekkert. Það var ekki rétt hér.","Er það ekki einkennilegt að okkur hefur fækkað um helming og samt tekst okkur ekki að komast hjá því að vinna hvert öðru mein? Ég greikkaði sporið. Veðlánabúð Als var bara hinum megin við hornið og ég yrði óhult þegar ég væri komin þangað inn. Þar sem ég stóð undir glóandi skilti sem á stóð Veðlánabúð Alborns leit ég við til að ganga úr skugga um að enginn hefði veitt mér eftirför. Ég hægði á mér og steig inn í þessa kunnuglegu veröld. Búðin var hálfgert leynifylgsni þar sem Alborn tók oft á móti stökkbreyttu fólki sem hafði smyglað sér leið inn í Paltricus. Ljósin voru slökkt þegar ég kom inn, og af einhverjum ástæðum var Alborn hvergi að finna. Hér voru engir flóttamenn og ekkert að sjá. Eitthvað var ekki eins og það átti að vera."
alirezamsh/small100,is,These good quality stickers are about 50p each. They'll cost the same again to post. And way more in my own time to individually package and send them.,Þessar góðar gæði sticker eru um 50p hver. Þeir mun kosta það sama aftur til að senda. Og leið meira í eigin tíma til að einstaklega pakka og senda þá.,Þessir hágæða límmiðar kosta um 50 pens hver. Það mun kosta það sama að póstleggja þá. Og meira en það hvað varðar tímann sem það myndi taka mig að pakka hverjum og einum inn og senda þá.
alirezamsh/small100,is,So the challenges in this are already showing themselves. I'm likely going to have a VERY difficult time getting a medical clearance due to the FAA's stance on certain medications.,Svo áskorunir í þessu eru nú þegar að sýna sig. Ég er líklega að hafa mjög erfitt tíma að fá læknisfræðilega hreinsun vegna viðhorf FAA á ákveðnum lyfjum.,"Ókei, þannig að það eru ýmsar áskoranir nú þegar farnar að gera vart við sig. Ég á líklega eftir að eiga MJÖG erfitt með að fá læknisleyfi vegna þess hvernig FAA metur viss lyf."
alirezamsh/small100,is,And just under the wire basically someone actually beat Trimming the Herbs! Really impressive.,Og bara undir þráðin í grundvallaratriðum einhver reyndar slá Trimming the Herbs! Virkilega áhrifamikill.,Og alveg á síðasta snúningi eiginlega því einhverjum tókst í alvörunni að klára Klippa jurtirnar! Vel gert!
alirezamsh/small100,is,Yea so I flew this today.,"Jæja, ég flogði þetta í dag.","Jæja, þannig að ég flaug þessu í dag."
alirezamsh/small100,is,"So my dad can't give me rides to work. And for me, work is about 27 miles away. So there and back would be nearly a $100 a day with Uber. I haven't looked at Lyft. I could have, I guess, that makes sense. But I didn't have rental on my auto insurance, so that's my fault. So I guess I could have tried to do that and get that set up and tried to get a rental while I was down and out of a car. But even then, a rental wouldn't cover seven days. I'm going to sneeze, hold on. That sneeze sucked.","Svo pabbi minn getur ekki gefið mér rit til að vinna. Og fyrir mig, vinnu er um 27 kílómetra í burtu. Svo þar og aftur myndi vera næstum $100 á dag með Uber. Ég hef ekki horft á Lyft. Ég gæti haft, ég held, það er skynsamlegt. En ég hafði ekki leigingu á bíl tryggingar mínar, svo það er mitt mistök. Svo ég held ég gæti reynt að gera það og fá það upp og reynt að fá leigingu meðan ég var niður og út af bíl. En jafnvel þá myndi leigja ekki ná sjö daga. Ég er að fara að snjója, halda áfram. Það snjója sucked.","Þannig að pabbi minn getur ekki skutlað mér í vinnuna, og fyrir mig er leiðin í vinnuna alveg 27 mílur, þannig að ferðin fram og til baka með Über væri næstum 100 dollarar á dag. Ég hef ekki skoðað Lyft, ég hefði kannski getað gert það, það hefði meikað sens, en ég var ekki með bílaleigutryggingu á bílatryggingunum mínum, þannig að það var mér að kenna. Þannig að ég býst við að ég hefði getað reynt það og reynt að stilla því upp þannig og fengið bílaleigubíl á meðan ég væri bíllaus. En jafnvel þá myndi bílaleigubíll ekki duga fyrir heila sjö daga. Ég þarf að hnerra, augnablik. Þetta var lélegur hnerri."
alirezamsh/small100,is,Saturday Cont:,Laugardagsreikningur:,Laugardagur frh:
alirezamsh/small100,is,"Rosendale, a member of the hard-right Freedom Caucus, was one of the individuals who derailed the Wednesday votes. He views the top line number in Johnson's deal as being too high and as doing too little to cut the $34 trillion national debt.","Rosendale, meðlimur af hard-hægri Freedom Caucus, var einn af þeim einstaklingum sem slökk á miðvikudag atkvæðagreiðslu. Hann lítur á efstu línu númer í samningi Johnson eins og að vera of hátt og eins og að gera of lítið til að skera $ 34 milljónir þjóðarskulda.","Rosendale, sem tilheyrir harðlínu-hægriáhrifahópnum Freedom Caucus, var einn af þeim sem stóð í vegi fyrir atkvæðagreiðslunni á miðvikudaginn. Honum þykir fjárhæðin í frumvarpi Johnsons vera of há og gera lítið til að saxa á 34 billjóna dollara skuld þjóðarbúsins."
alirezamsh/small100,is,"South Wales four-piece The Now are proud to release their debut album, Too Hot To Handle, via True Music, and Callum joins me now. How are you doing, Callum? How's it going? Yeah, all good. Good, yourself? Yes, I'm very good. Thank you. It's a privilege to speak to yourselves because I've been listening to your music quite a lot since 2023. So I'm just loving the music, and I think it's something that we definitely need in the charts these days.","South Wales fjórar stykki The Now eru stolt af að gefa út fyrstu plötu þeirra, Too Hot To Handle, í gegnum True Music, og Callum tengist mér núna. Hvernig ert þú að gera, Callum? Hvernig er það að fara? Já, allt gott. Góður, sjálfur? Já, ég er mjög góður. Takk. Það er forréttindi að tala við þig vegna þess að ég hef hlustað á tónlist þína nokkuð mikið frá 2023. Svo ég er bara að elska tónlistina, og ég held að það er eitthvað sem við vissulega þurfum í ritunum á þessum dögum.","The Now, kvartettinn frá Suður-Wales, er að gefa út nýja plötu sem þeir eru stoltir af. Platan kemur út hjá True Music og ber titilinn Too Hot to handle, og Callum er mættur hingað til mín. Hvað segir þú gott, Callum? Hvernig gengur? Já, allt í góðu. Og þú sjálfur? Já, ég er góður. Takk fyrir. Það eru forréttindi að fá að tala við ykkur þar sem ég hef verið að hlusta mikið á tónlistina ykkar síðan 2023. Þannig að ég er bara að fíla tónlistina ykkar í botn og finnst hún vera eitthvað sem okkur vantar inn á topplistana þessa dagana."
