alirezamsh/small100,bg,"However, Tenuk and Kayel quickly realized they weren't alone. A second dark creature shot out from beneath them, and Tenuk only just managed to avoid a collision.","Въпреки това, Тенук и Кейл бързо осъзнаха, че не са сами. Второ тъмно същество изстреляно от под тях, а Тенук просто успя да избегне сблъсък.","Въпреки това Тенук и Кайел бързо осъзнаха, че не са сами. Второ тъмно създание се изстреля зад тях и Тенук едва успя да избегне сблъсъка."
alirezamsh/small100,bg,"Tenuk hesitated, then stepped back, giving himself some space. With a low, slightly pained grunt, Tenuk's body stretched out, his fur replaced with scales and his arms replaced with wings. He quickly turned himself into a normal, light blue Thraki, but his eyes remained red.","Тенук се колебаеше, след това се върна назад, давайки себе си малко пространство. С ниска, леко болезнена земя, тялото на Тенук се разтяга, кожата му се заменя с скали и ръцете му се заменят с крилете.","Тенук се поколеба, след това пристъпи назад, освобождавайки си място. Със слаб, леко болезнен вик тялото на Тенук се издължи, козината му се смени с люспи, а ръцете му – с крила. Той бързо се превърна в нормално, светлосиньо Траки, но очите му останаха червени."
alirezamsh/small100,bg,"They wondered if she would actually let them enter, unlike the previous times they went to ask. I still have a bruise from the last time. Ivory chuckled from the memory. Kari had thrown a book at their shoulder, but when she saw who it was, she apologized immediately.","Те се чудеха дали тя всъщност ще ги пусне да влязат, за разлика от предишните пъти, които отидоха да питат. Аз все още имам брада от последния път. Слоновете се разкъсаха от паметта. Кари хвърлиха книга на рамото им, но когато видя кой е, тя веднага се извиняваше.","Чудеше се дали сега въобще ще го пусне вътре, но за разлика от предните пъти, този път той попита. Все още имам синина от последния път. Айвъри се засмя, като си спомни. Кари хвърли книга към рамото му, но щом видя кой е, се извини веднага."
alirezamsh/small100,bg,"The ESP didn't go online immediately, let's give it a few minutes.","ЕПП не е отишъл веднага онлайн, нека му дадем няколко минути.","ESP не се показва онлайн веднага, да изчакаме няколко минути."
alirezamsh/small100,bg,"Ignacio Sánchez Recarte, secretary general of the Comité Européen des Entreprises Vins trade association representing some 7,000 wine producers across Europe, is dismissive of the concerns of the beer makers. He told Euronews that a market dominated by multinational brewing conglomerates bears no comparison with one comprised almost entirely of small, domestic producers.","Игнасио Санчес Рекарт, генерален секретар на Европейската асоциация за търговия с вино в Европейския комитет на предприятията, представляваща около 7 000 винопроизводители в цяла Европа, е отхвърлен от опасенията на производителите на бира. Той каза на Euronews, че пазарът, доминиран от мултинационални конгломерати, не носи сравнение с този, състоящ се почти изцяло от малки вътрешни производители.","Игнасио Санчез Рекарте, генерален секретар на търговската асоциация Comité Européen des Entreprises Vins, представляваща около 7000 винопроизводители от цяла Европа, не приема притесненията на производителите на бира. Той заяви за Euronews, че пазарът, доминиран от мултинационални пивоварни конгломерати, не може по никакъв начин да се сравнява с пазар, съставен почти изцяло от малки местни производители."
alirezamsh/small100,bg,@user4 @user3 @user5 @user6,@user4 @user3 @user5 @user6,@user4 @user3 @user5 @user6
alirezamsh/small100,bg,"Judging by the state of our hospitals, the SNP's talk of recovery plans and action plans is simply that - talk, and dangerous talk at that. We must not allow incompetent politicians to lull us into complicity in the demise of that great British institution, the National Health Service.","Съдейки според състоянието на нашите болници, речта на SNP за плановете за възстановяване и плановете за действие е просто това - да говорим, и опасно да говорим за това.Не трябва да позволяваме на некомпетентните политици да ни заблудят в сътрудничество в оттеглянето на тази голяма британска институция, Националната здравна служба.","Съдейки по състоянието на болниците ни, SNP и обещанията им за план за възстановяване и план за действие са само това – обещания, при това опасни. Не трябва да позволяваме на некомпетентни политици да ни въвлекат в съучастие в срутването на тази велика британска институция, Националната здравна служба (NHS)."
alirezamsh/small100,bg,🚨 breaking news:,разкъсване на новини:,🚨 горещи новини:
alirezamsh/small100,bg,This song is encapsulates my predicament…,Тази песен е вдъхновена от моята представа...,Тази песен обобщава моето положение...
alirezamsh/small100,bg,Both the old and the new Listing titles call it a 12V 10W panel.,"Както старите, така и новите заглавия на списъка го наричат 12V 10W панел.","И в новата, и в старата обява се казва панел 12 V 10 W."
alirezamsh/small100,bg,"Isn’t that funny? We have half the manpower left, and we can’t even refrain from hurting one another. I hastily sped up, Al’s was around the corner, so I would be fine inside. A glance behind me ensured that I was no longer being tailed as I stood in front of a bright glowing sign that read, “Alborn’s Pawnshop!” With slower steps, I entered once again–this place was more under the cover, as Alborn would often take in people who’d been mutated and snuck into Paltricus. Upon opening the door, the lights had been shut off, interestingly enough–there was no Al. No refugees. Nothing. Something wasn’t right here.","Не е ли това смешно? Имаме половината от човешката сила, и ние дори не можем да се въздържаме от нараняването един на друг. Бързо се издигах, Ал беше около ъгъла, така че бих бил добре вътре. Поглед зад мен гарантира, че вече не бях заглавен, тъй като стоях пред ярък блясък знак, че че четеше: „Алберн’s Pawnshop!“ С по-бавни стъпки, влязох отново – това място беше по-под капака, тъй като Алберн често би взел в хора, които са били мутирани и сгънали в Палтрикус. Когато отвори вратата, светлините бяха изключени, интересно достатъчно – нямаше Ал. Няма бежанци. Нищо. Нещо не беше правилно тук.","Не е ли забавно? Намаляхме наполовина и дори не можем да спрем да се нараняваме сами. Забързах се, Aл беше зад ъгъла и щях да съм на сигурно място вътре. Погледнах зад мен да се уверя, че не ме следят, докато стоях пред светла табела „Заложната къща на Алборн!“. С бавни крачки влязох вътре – това беше място под прикритие, защото Алборн приютяваше мутирали хора и ги вмъкваше в Палтрикус. След като отворих вратата, светлините бяха загасени, а по-интересното – Ал го нямаше. Нямаше бежанци. Нищо. Нещо не беше наред."
alirezamsh/small100,bg,These good quality stickers are about 50p each. They'll cost the same again to post. And way more in my own time to individually package and send them.,Тези висококачествени стикери са около 50p всеки. Те ще струват същото отново за изпращане. И много повече в собственото си време за индивидуално опаковане и да ги изпратите.,"Тези стикери с добро качество струват по около 50 пенса на брой. Ще струват също толкова и когато се изпратят по пощата. И много повече от собственото ми време,за да ги опаковам и да ги изпратя."
alirezamsh/small100,bg,So the challenges in this are already showing themselves. I'm likely going to have a VERY difficult time getting a medical clearance due to the FAA's stance on certain medications.,Така че предизвикателствата в това вече се показват. Вероятно ще имам много трудно време да получа медицински клиринс поради позицията на ФАА по отношение на определени лекарства.,Предизвикателствата вече се показват. Вероятно ще ми бъде МНОГО трудно да получа медицинско одобрение поради позицията на FAA относно някои лекарства.
alirezamsh/small100,bg,And just under the wire basically someone actually beat Trimming the Herbs! Really impressive.,И точно под жицата по същество някой наистина удари рязане на билки! Наистина впечатляващо.,И точно в последния момент някой наистина победи Trimming the Herbs! Наистина впечатляващо.
alirezamsh/small100,bg,Yea so I flew this today.,Така че аз летях днес.,"Да, аз летях с това днес."
alirezamsh/small100,bg,"So my dad can't give me rides to work. And for me, work is about 27 miles away. So there and back would be nearly a $100 a day with Uber. I haven't looked at Lyft. I could have, I guess, that makes sense. But I didn't have rental on my auto insurance, so that's my fault. So I guess I could have tried to do that and get that set up and tried to get a rental while I was down and out of a car. But even then, a rental wouldn't cover seven days. I'm going to sneeze, hold on. That sneeze sucked.","Така че баща ми не може да ми даде шофиране на работа. И за мен, работата е около 27 мили. Така че там и назад ще бъде почти $100 на ден с Uber. Аз не съм погледнал Lyft. Мога да имам, мисля, че има смисъл. Но аз не съм имал под наем на автомобилната си застраховка, така че това е моята вина. Така че мисля, че бих могъл да се опита да направя това и да се установи и се опитах да получи под наем, докато бях надолу и извън колата. Но дори тогава, под наем няма да покрие седем дни. Аз ще се снежа, задържайте. Това снежа се засмуква.","Баща ми не може да ме кара до работа. А моята работа е на около 27 мили, така че дотам и обратно би било почти 100 долара на ден с Uber. Не съм проверявал с Lyft. Бих могъл, вероятно си струва. Но нямам включен наем в моята автомобилна застраховка, това си е моя грешка. Предполагам, че можех да направя това и да се опитам да наема кола, докато съм без кола. Но дори и така, наемът не би покрил седем дни. Ще кихна, задръж така. Това кихане е гадно."
alirezamsh/small100,bg,Saturday Cont:,Събота за събота:,Събота прод.:
alirezamsh/small100,bg,"Rosendale, a member of the hard-right Freedom Caucus, was one of the individuals who derailed the Wednesday votes. He views the top line number in Johnson's deal as being too high and as doing too little to cut the $34 trillion national debt.","Розендейл, член на твърдо-дясното Freedom Caucus, беше един от хората, които отхвърлиха в сряда гласуването. Той смята, че горната линия номер в сделката на Джонсън е твърде висока и че прави твърде малко, за да намали 34 трилиона долара националния дълг.","Розендейл, член на крайнодесния партиен актив Freedom Caucus, беше един от онези членове, които попречиха на гласуванията в сряда. Той счита числото от сделката на Джонсън за твърде голямо и недостатъчно, за да намали националния дълг, възлизащ на 34 трилиона щатски долара."
alirezamsh/small100,bg,"South Wales four-piece The Now are proud to release their debut album, Too Hot To Handle, via True Music, and Callum joins me now. How are you doing, Callum? How's it going? Yeah, all good. Good, yourself? Yes, I'm very good. Thank you. It's a privilege to speak to yourselves because I've been listening to your music quite a lot since 2023. So I'm just loving the music, and I think it's something that we definitely need in the charts these days.","South Wales четири парчета The Now са горди да пуснат дебютния си албум, Too Hot To Handle, чрез True Music, и Callum се присъединява към мен сега. Как правите, Callum? Как ще се случи? Да, всичко добре. Добро, себе си? Да, аз съм много добър. Благодаря. Това е привилегия да говоря със себе си, защото слушам музиката си доста от 2023 година. Така че просто обичам музиката и мисля, че това е нещо, което определено се нуждаем в диаграмите тези дни.","Квартетът The Now от Южен Уелс с гордост издадоха своя дебютен албум, Too Hot To Handle, чрез True Music и Калъм е при мен сега. Как си, Калъм? Как върви? Всичко е наред. Добре ли си? Да, много съм добре, благодаря. За мен е привилегия да разговарям с теб, защото слушам вашата музика доста от 2023 година насам. Много ми харесва музиката и мисля, че е нещо, което определено трябва да бъде в класациите в наши дни."
alirezamsh/small100,bg,"The results are in and, drum roll, please, it's completely consistent with my family history. 89.9% British and Irish with most of that concentrated in the scottish borders, western Ireland, Wales, and cornwall. It doesn't show much breton tho so either they're so close to cornish they don't show as different in me or my breton family wasn't originally from there.","Резултатите са в и, барабан рол, моля, тя е напълно в съответствие с моята семейна история. 89.9% британски и ирландски с най-голямата част от това, концентрирани в шотландските граници, Западна Ирландия, Уелс и царевица. Това не показва много Бретън Тон, така че или те са толкова близо до царевица те не изглеждат по-различни в мен или моето Бретън семейство не беше първоначално от там.","Резултатите пристигнаха, фанфари моля, това е напълно в съответствие със семейната ми история. 89,9% британци и ирландци, повечето от които са концентрирани в границите с Шотландия, Западна Ирландия, Уелс и Корнуол. Не се показват много бретонски обаче, така че или са много близки до корнуолските и не се показват като различни в мен, или моето бретонско семейство не произхожда първоначално оттам."
alirezamsh/small100,hr,"However, Tenuk and Kayel quickly realized they weren't alone. A second dark creature shot out from beneath them, and Tenuk only just managed to avoid a collision.","Međutim, Tenuk i Kayel brzo su shvatili da nisu sami. Drugo mračno stvorenje izbačeno iz ispod njih, a Tenuk je samo uspio izbjeći sudar.","No, Tenuk i Kayel ubrzo su shvatili da nisu sami. Drugo tamno stvorenje izronilo je ispod njih, a Tenuk je jedva uspio izbjeći sudar."
alirezamsh/small100,hr,"Tenuk hesitated, then stepped back, giving himself some space. With a low, slightly pained grunt, Tenuk's body stretched out, his fur replaced with scales and his arms replaced with wings. He quickly turned himself into a normal, light blue Thraki, but his eyes remained red.","Tenuk je oklijevao, zatim se vratio, dao sebi malo prostora. S niskim, lagano bolnim gruntom, Tenukovo tijelo se proteže, njegova kosa je zamijenila skalama i ruke zamijenila krila. Brzo se pretvorio u normalan, svijetlo plavi Thraki, ali njegove oči su ostale crvene.","Tenuk je oklijevao, zatim se odmaknuo da bi dobio prostora. Tiho i pomalo bolno dašćući, Tenukovo se tijelo istegnulo, njegovo krzno zamijenile su ljuske, a ruke krila. Brzo se pretvorio u uobičajenog, svjetloplavog Thrakija, ali oči su mu ostale crvene."
alirezamsh/small100,hr,"They wondered if she would actually let them enter, unlike the previous times they went to ask. I still have a bruise from the last time. Ivory chuckled from the memory. Kari had thrown a book at their shoulder, but when she saw who it was, she apologized immediately.","Pitao su se hoće li ih zapravo dopustiti da uđu, za razliku od prethodnih vremena koji su otišli pitati. Još uvijek imam bradavicu od posljednjeg vremena. Ivory je šutnuo iz sjećanja. Kari je bacio knjigu na ramena, ali kad je vidjela tko je to, odmah se ispričala.","Pitali su se hoće li ih zapravo pustiti da uđe, za razliku od prethodnog puta kada su zatražili. Još uvijek imam modricu od prošlog puta, Ivory su se smješkali sjetivši se. Kari je bacila knjigu u njihovo rame, ali kada je vidjela tko je, odmah se ispričala."
alirezamsh/small100,hr,"The ESP didn't go online immediately, let's give it a few minutes.","ESP nije odmah otišao online, dajmo ga nekoliko minuta.",ESP se nije odmah priključio na mrežu. Dajmo mu nekoliko minuta.
alirezamsh/small100,hr,"Ignacio Sánchez Recarte, secretary general of the Comité Européen des Entreprises Vins trade association representing some 7,000 wine producers across Europe, is dismissive of the concerns of the beer makers. He told Euronews that a market dominated by multinational brewing conglomerates bears no comparison with one comprised almost entirely of small, domestic producers.","Ignacio Sánchez Recarte, generalni tajnik Odbora Européen des Entreprises Vins, koji predstavlja oko 7.000 proizvođača vina diljem Europe, odustaje od zabrinutosti proizvođača piva, rekao je Euronews da tržište koje dominiraju multinacionalni pivovarski konglomerati nema usporedbu s onim koji se sastoji gotovo u cijelosti od malih domaćih proizvođača.","Ignacio Sánchez Recarte, glavni tajnik udruženja vinara Europski odbor za proizvođače vina, koje predstavlja oko 7000 proizvođača vina iz cijele Europe, odbacuje zabrinutost proizvođača piva. Za Euronews je izjavio da se tržište kojim dominiraju višenacionalni pivarski konglomerati ne može usporediti s onim kojega gotovo u potpunosti sačinjavaju mali, domaći proizvođači."
alirezamsh/small100,hr,@user4 @user3 @user5 @user6,@user4 @user3 @user5 @user6,@user4 @user3 @user5 @user6
alirezamsh/small100,hr,"Judging by the state of our hospitals, the SNP's talk of recovery plans and action plans is simply that - talk, and dangerous talk at that. We must not allow incompetent politicians to lull us into complicity in the demise of that great British institution, the National Health Service.","Sudeći po stanju naših bolnica, govor SNP-a o planovima oporavka i akcijskim planovima je jednostavno to - govoriti, i opasno govoriti o tome.","Sudeći prema stanju naših bolnica, SNP-ove riječi o planovima oporavka i akcijskim planovima samo su riječi, i to opasne riječi. Ne smijemo dopustiti nesposobnim političarima da nas uljuljkaju u suučesništvo u propasti te velike britanske institucije, Nacionalnog zdravstva."
alirezamsh/small100,hr,🚨 breaking news:,Razbijanje vijesti:,🚨 Prijelomne vijesti:
alirezamsh/small100,hr,This song is encapsulates my predicament…,Ova pjesma je usmjerena na moju predhodnost...,Ova pjesma savršeno sumira kašu u kojoj se nalazim...
alirezamsh/small100,hr,Both the old and the new Listing titles call it a 12V 10W panel.,I stari i novi naslove Listing nazivaju ga 12V 10W panel.,Naslovi za stari i novi opis proizvoda opisuju ga kao panel od 12 V i 10 W.
