alirezamsh/small100,et,"The ESP didn't go online immediately, let's give it a few minutes.","ESP ei käinud kohe internetis, andkem sellele paar minutit.","ESP ei ilmunud kohe võrku, ootame mõne minuti."
alirezamsh/small100,et,"Ignacio Sánchez Recarte, secretary general of the Comité Européen des Entreprises Vins trade association representing some 7,000 wine producers across Europe, is dismissive of the concerns of the beer makers. He told Euronews that a market dominated by multinational brewing conglomerates bears no comparison with one comprised almost entirely of small, domestic producers.","Ignacio Sánchez Recarte, Komitee Européen des Entreprises Vins kaubandusühiskonna peasekretär, kes esindab umbes 7 000 veinitootjat kogu Euroopas, on õlletootjate muret kõrvale jäetud. Ta ütles Euronewsile, et rahvusvaheliste õlletootjate domineeriv turg ei ole võrreldav peaaegu täielikult väikestest siseriiklikest tootjatest.","Enam kui 7000 Euroopa veinitootjat esindava kaubandusassotsiatsiooni Comité Européen des Entreprises Vins peasekretär Ignacio Sanchez Recarte on õlletootjate murede suhtes tõrjuv. Ta ütles Euronewsile, et rahvusvaheliste õllekonglomeraatide poolt domineeritud turg ei ole võrreldav turuga, mis koosneb peaaegu täielikult väikestest kodumaistest tootjatest."
alirezamsh/small100,et,@user4 @user3 @user5 @user6,@user4 @user3 @user5 @user6,@user4 @user3 @user5 @user6
alirezamsh/small100,et,"Judging by the state of our hospitals, the SNP's talk of recovery plans and action plans is simply that - talk, and dangerous talk at that. We must not allow incompetent politicians to lull us into complicity in the demise of that great British institution, the National Health Service.","Otsustades meie haiglate seisundit, on SNP kõne taastumisplaanide ja tegevuskavade kohta lihtsalt see - rääkida ja ohtlik rääkida sellest.Me ei tohiks lubada, et ebakompetentsed poliitikud petta meid selle suure Briti institutsiooni, riikliku tervishoiuteenuse taganemisega kaasas.","Meie haiglate olukorra järgi otsustades jääb Šoti rahvuspartei jutt päästekavadest ja tegevuskavadest lihtsalt jutuks, ja seejuures ohtlikuks jutuks. Me ei tohi lasta ebapädevatel poliitikutel end uinutada ja teha kaassüüdlaseks suurepärase Briti institutsiooni, riikliku tervishoiuteenistuse allakäigus."
alirezamsh/small100,et,🚨 breaking news:,murduvad uudised:,🚨 värsked uudised:
alirezamsh/small100,et,This song is encapsulates my predicament…,See laul sisaldab minu eelnõu...,See laul võtab kokku mu raske olukorra ...
alirezamsh/small100,et,Both the old and the new Listing titles call it a 12V 10W panel.,Nii vanad kui ka uued nimed nimetatakse seda 12V 10W paneeliks.,"Mõlemad, nii vana kui ka uue kuulutuse pealkirjad nimetavad seda 12 V 10 W paneeliks."
alirezamsh/small100,et,"Isn’t that funny? We have half the manpower left, and we can’t even refrain from hurting one another. I hastily sped up, Al’s was around the corner, so I would be fine inside. A glance behind me ensured that I was no longer being tailed as I stood in front of a bright glowing sign that read, “Alborn’s Pawnshop!” With slower steps, I entered once again–this place was more under the cover, as Alborn would often take in people who’d been mutated and snuck into Paltricus. Upon opening the door, the lights had been shut off, interestingly enough–there was no Al. No refugees. Nothing. Something wasn’t right here.","Kas pole nii naljakas? Meil on pool inimvõimsust jäänud ja me ei saa isegi vältida üksteist vigastamist. Ma kiirustasin kiiresti üles, Al oli ümber nurga, nii et ma oleksin hea sees. Vaade minu taga tagas, et ma ei olnud enam kaetud, kui ma seisin ees särav säravat märki, mis luges: ""Alborn's Pawnshop!"" aeglasemate sammudega sisenesin ma uuesti – see koht oli rohkem katte alla, sest Alborn oleks sageli võtnud inimestele, kes oleks olnud muteeritud ja kallutatud Paltricusesse. Kui ukse avas, tuled olid välja lülitatud, huvitav piisavalt – seal ei olnud Al. Ei pagulased. Miski. Siin ei olnud midagi.","Kas pole naljakas? Meist on ainult pooled järel ja me ei suuda hoiduda teineteise vigastamisest. Ma läksin kiiresti ees ära, Al'i pood oli nurga taga, seal sees oli turvaline. Pilk selja taha kinnitas, et mind ei jälitatud enam, kui ma seisin poe ees, millel oli ere särav silt, kust võis lugeda „Alborni pandimaja!“ Aeglasemal sammul astusin uuesti sisse – see koht oli rohkem peidetud, sest Alborn võttis tihti enda hoole all muteerunud inimesi ja aitas neil hiilida Paltricusesse. Kui ukse avasin, siis nägin, et tuled olid välja lülitatud, huvitaval kombel ei olnud siin Ali. Polnud põgenikke. Polnud midagi. Miski ei olnud siin õige."
alirezamsh/small100,et,These good quality stickers are about 50p each. They'll cost the same again to post. And way more in my own time to individually package and send them.,Need hea kvaliteediga klisterid on umbes 50p igaüks. Nad maksavad sama jälle postitada. Ja palju rohkem oma aega individuaalselt pakendada ja saata neid.,Need kvaliteetsed kleepsud maksavad 50 penni tükist. Nende saatmine maksab teist samapalju. Ja minu ajakulu nende ükshaaval pakkimiseks ja saatmiseks on märksa suurem.
alirezamsh/small100,et,So the challenges in this are already showing themselves. I'm likely going to have a VERY difficult time getting a medical clearance due to the FAA's stance on certain medications.,"Nii et väljakutsed selles juba näitavad end. Ma tõenäoliselt on väga raske aeg saada meditsiinilist kliirensit, kuna FAA seisukoht teatavate ravimite kohta.",Seega on sellega seotud väljakutsed juba pead tõstmas. Mul saab vast olema VÄGA keeruline saada meditsiinilist luba õhkutõusmiseks FAA seisukoha pärast seoses teatud ravimitega.
alirezamsh/small100,et,And just under the wire basically someone actually beat Trimming the Herbs! Really impressive.,Ja just alla traadi põhimõtteliselt keegi tegelikult lööb lõigamine maitsetaimed! tõesti muljetavaldav.,Ja põhimõtteliselt täiesti viimasel hetkel on keegi alistanud „Trimming the Herbsi”! Väga muljetavaldav.
alirezamsh/small100,et,Yea so I flew this today.,Nii et ma täna lendasin.,"Jah, ma lendasin täna."
alirezamsh/small100,et,"So my dad can't give me rides to work. And for me, work is about 27 miles away. So there and back would be nearly a $100 a day with Uber. I haven't looked at Lyft. I could have, I guess, that makes sense. But I didn't have rental on my auto insurance, so that's my fault. So I guess I could have tried to do that and get that set up and tried to get a rental while I was down and out of a car. But even then, a rental wouldn't cover seven days. I'm going to sneeze, hold on. That sneeze sucked.","Nii et mu isa ei saa mulle sõita tööle. Ja minu jaoks on töö umbes 27 miili kaugusel. Nii et seal ja tagasi oleks peaaegu 100 dollarit päevas Uberiga. Ma ei ole vaadanud Lyft. Ma võin olla, ma arvan, et see on mõtet. Aga ma ei olnud renti oma auto kindlustus, nii et see on minu süü. Nii et ma arvan, et ma oleks võinud seda teha ja saada see seadistatud ja proovinud saada renti, kui ma olin alla ja väljas auto. Aga isegi siis, renti ei katta seitse päeva. Ma hakkan lumma, hoidma. See lumma imeti.","Nii, mu isa ei saa mind tööle sõidutada. Minu puhul on töö umbes 27 miili kaugusel. Seega sinna ja tagasi jõudmiseks kuluks peaaegu 100 dollarit päevas, kui kasutada Uberit. Ma ei ole veel Lyfti vaadanud. Ma oleks võinud, ilmselt on see loogiline. Aga mul ei olnud autokindlustusega kaasas rendiauto võimalust, seega see on minu viga. Seega oleksin võinud proovida seda teha ja selle paika panna ning saada rendiauto ajaks, mil minu auto ei tööta. Kuid isegi siis ei saaks rendiautot seitse päeva kasutada. Ma aevastan, oota korra. See aevastus oli halb."
alirezamsh/small100,et,Saturday Cont:,Laupäeva kontod:,Laupäevane Cont:
alirezamsh/small100,et,"Rosendale, a member of the hard-right Freedom Caucus, was one of the individuals who derailed the Wednesday votes. He views the top line number in Johnson's deal as being too high and as doing too little to cut the $34 trillion national debt.","Rosendale, raske parempoolse Freedom Caucuse liige, oli üks üksikisikuid, kes lükkas kolmapäeval hääletusi. Ta näeb Johnsoni kokkuleppe ülemise rida number liiga kõrge ja kui teha liiga vähe, et vähendada 34 triljonit dollarit riigi võla.","Rosendale, kes on äärmusparempoolse Freedom Caucuse liige, oli üks nendest, kes takistas kolmapäeval hääletuste õnnestumist. Tema meelest on Johnsoni leppe kõrgeim piirnumber liiga kõrge ja see lepe ei ole piisav selleks, et 34 triljoni USA dollari suurust riigivõlga kärpida."
alirezamsh/small100,et,"South Wales four-piece The Now are proud to release their debut album, Too Hot To Handle, via True Music, and Callum joins me now. How are you doing, Callum? How's it going? Yeah, all good. Good, yourself? Yes, I'm very good. Thank you. It's a privilege to speak to yourselves because I've been listening to your music quite a lot since 2023. So I'm just loving the music, and I think it's something that we definitely need in the charts these days.","Lõuna-Waleesi nelja tükki The Now on uhked oma debüütialbum, Too Hot To Handle, läbi True Music, ja Callum liitub minuga nüüd. Kuidas sa teed, Callum? Kuidas see läheb? Jah, kõik hästi. Hea, sina? Jah, ma olen väga hea. Aitäh. See on privileeg rääkida iseendale, sest ma olen kuulnud oma muusikat üsna palju alates 2023. Nii et ma lihtsalt armastan muusikat, ja ma arvan, et see on midagi, mida me kindlasti vajame nendel päevadel diagrammides.","South Walesi neljaliikmeline The Now annab uhkusega välja oma debüütalbumi „Too Hot To Handle“ kasutades selleks True Musicut ning nüüd liitub minuga Callum. Kuidas sul läheb, Callum? Kuidas läheb? Jaa, kõik on hästi. Hästi, kuidas sul? Jah, mul läheb väga hästi, aitäh. On privileeg sinuga bändist rääkida, sest ma olen 2023. aastast teie muusikat päris palju kuulanud. Ma lihtsalt armastan muusikat ja ma arvan, et see on midagi, mida me praegusel ajal kindlasti edetabelites vajame."
alirezamsh/small100,et,"The results are in and, drum roll, please, it's completely consistent with my family history. 89.9% British and Irish with most of that concentrated in the scottish borders, western Ireland, Wales, and cornwall. It doesn't show much breton tho so either they're so close to cornish they don't show as different in me or my breton family wasn't originally from there.","Tulemused on ja, drum roll, palun, see on täiesti kooskõlas minu perekonna ajalugu. 89.9% Briti ja Iiri, kusjuures enamasti keskendunud Šoti piires, Lääne-Iirimaa, Wales, ja maini. See ei näita palju brettoni tho nii, et kas nad on nii lähedased maini nad ei näita, nagu erinevad minu või minu brettoni perekond ei olnud algselt seal.","Tulemused on käes ja, nüüd palun trummipõrin, need vastavad täielikult minu perekonna ajaloole. 89,9% briti ja iiri verd, millest suurem osa on koondunud Šoti piiri ümbrusse, Lääne-Iirimaale, Walesi ja Cornwalli. Bretooni osa pole siiski kuigivõrd näha, nii et üks kahest – nad on kas kõmridele nii lähedased, et ei paista minus eraldi välja, või ei pärinenud mu bretooni suguvõsa algselt sealt."
alirezamsh/small100,fi,"However, Tenuk and Kayel quickly realized they weren't alone. A second dark creature shot out from beneath them, and Tenuk only just managed to avoid a collision.","Kuitenkin Tenuk ja Kayel nopeasti tajusivat, että he eivät olleet yksin. Toinen pimeä olento ampui alhaalta, ja Tenuk onnistui vain välttämään törmäystä.","Tenuk ja Kayel huomasivat kuitenkin pian, etteivät he olleet yksin. Toinen musta olio nousi ilmaan heidän altaan, ja Tenuk onnistui juuri ja juuri välttämään törmäyksen."
alirezamsh/small100,fi,"Tenuk hesitated, then stepped back, giving himself some space. With a low, slightly pained grunt, Tenuk's body stretched out, his fur replaced with scales and his arms replaced with wings. He quickly turned himself into a normal, light blue Thraki, but his eyes remained red.","Tenuk epäröi, sitten astui takaisin antaen itselleen jonkin verran tilaa. Alhaisella, hieman kivulias, Tenukin keho venytti ulos, hänen karvansa korvattiin asteikkoilla ja hänen käsivartansa korvattiin siivet. Hän kääntyi nopeasti normaaliksi, kevytsiniseksi Thrakiin, mutta hänen silmänsä pysyivät punaisina.","Tenuk epäröi, mutta astui sitten taaksepäin ja otti tilaa. Tenuk murahti hieman tuskaisena, ja sitten hänen kehonsa alkoi venyä. Hänen turkkinsa tilalle tuli suomuja, ja hänen kätensä tilalle kasvoivat siivet. Hän muutti nopeasti itsensä tavalliseksi vaaleansiniseksi thrakiksi, mutta hänen silmänsä olivat yhä punaiset."
alirezamsh/small100,fi,"They wondered if she would actually let them enter, unlike the previous times they went to ask. I still have a bruise from the last time. Ivory chuckled from the memory. Kari had thrown a book at their shoulder, but when she saw who it was, she apologized immediately.","He ihmettelevät, voisivatko hän todella antaa heidät sisään, toisin kuin aikaisemmin he menivät kysyä. Minulla on vielä hiljainen viimeisestä kerrasta. Ivory ryöstyi muistiin. Kari oli heittänyt kirjan olkapäähänsä, mutta kun hän näki, kuka se oli, hän pyysi välittömästi anteeksi.","Ivory ihmetteli, päästettäisiinkö hänet sisälle, toisin kuin aiemmilla pyyntökerroilla. Minulla on yhä mustelma edelliskerralta. Ivory hihitti muistolle. Kari oli heittänyt häntä kirjalla olkapäähän, mutta kun tämä oli nähnyt, kuka vierailija oli, hän oli heti pyytänyt anteeksi."
alirezamsh/small100,fi,"The ESP didn't go online immediately, let's give it a few minutes.","ESP ei käynyt verkossa välittömästi, anna se muutama minuutti.",ESP ei yhdistänyt verkkoon välittömästi. Annetaan sille muutama minuutti.
alirezamsh/small100,fi,"Ignacio Sánchez Recarte, secretary general of the Comité Européen des Entreprises Vins trade association representing some 7,000 wine producers across Europe, is dismissive of the concerns of the beer makers. He told Euronews that a market dominated by multinational brewing conglomerates bears no comparison with one comprised almost entirely of small, domestic producers.","Ignacio Sánchez Recarte, Comité Européen des Entreprises Vins -kauppajärjestön pääsihteeri, joka edustaa noin 7 000 viinintuottajaa ympäri Eurooppaa, on poikkeuksellinen oluttavalmistajien huolenaiheista. Hän kertoi Euronewsille, että monikansalliset oluttavalmisteet hallitsevat markkinat eivät ole verrattavissa lähes kokonaan pienistä kotimaisista tuottajista.","Ignacio Sánchez Recarte, noin 7 000:ta eurooppalaista viinintuottajaa edustavan Comité Européen des Entreprises Vins -kauppajärjestön pääsihteeri, suhtautuu torjuvasti oluenvalmistajien huoliin. Hän kertoi Euronewsille, että monikansallisten panimokonsernien hallitsemia markkinoita ei voi verrata markkinoihin, jotka koostuvat lähes kokonaan pienistä paikallisista tuottajista."
alirezamsh/small100,fi,@user4 @user3 @user5 @user6,@user4 @user3 @user5 @user6,@user4 @user3 @user5 @user6
alirezamsh/small100,fi,"Judging by the state of our hospitals, the SNP's talk of recovery plans and action plans is simply that - talk, and dangerous talk at that. We must not allow incompetent politicians to lull us into complicity in the demise of that great British institution, the National Health Service.","Sairaalan tilan mukaan SNP: n puhuminen elpymissuunnitelmista ja toimintasuunnitelmista on yksinkertaisesti se - puhua ja vaarallista puhua siitä. Emme saa sallia epäkompetenttisille poliitikkoille huijata meidät samantyyppisyyteen tuon suuren brittiläisen laitoksen, kansallisen terveyspalvelun luomiseen.","Sairaaloiden nykytilan perusteella kansallispuolueen puheet elvyttämis- ja toimintasuunnitelmista ovat juuri sitä - pelkkää puhetta, ja vieläpä vaarallista puhetta. Emme saa antaa epäpätevien poliitikkojen tuudittaa meitä hyväksymään suuren brittiläisen instituution, terveydenhuoltojärjestelmän, kuolemaa."
alirezamsh/small100,fi,🚨 breaking news:,rikkovat uutiset:,🚨 uutisia:
alirezamsh/small100,fi,This song is encapsulates my predicament…,Tämä laulu on kapselattu minun esityksiä...,Tämä kappale kuvastaa ongelmaani...
alirezamsh/small100,fi,Both the old and the new Listing titles call it a 12V 10W panel.,Sekä vanhat että uudet luettelon otsikot kutsuvat sitä 12V 10W-paneeliksi.,Sekä vanha ja uusi speksien otsikko kutsuu sitä 12 V:n 10 W:n paneeliksi.
alirezamsh/small100,fi,"Isn’t that funny? We have half the manpower left, and we can’t even refrain from hurting one another. I hastily sped up, Al’s was around the corner, so I would be fine inside. A glance behind me ensured that I was no longer being tailed as I stood in front of a bright glowing sign that read, “Alborn’s Pawnshop!” With slower steps, I entered once again–this place was more under the cover, as Alborn would often take in people who’d been mutated and snuck into Paltricus. Upon opening the door, the lights had been shut off, interestingly enough–there was no Al. No refugees. Nothing. Something wasn’t right here.","Eikö se ole niin hauskaa? Meillä on puolet ihmisvoimasta jäljellä, emmekä voi edes pidättäytyä vahingoittamasta toisiaan. Kiihdyin nopeasti, Al oli kulman ympärillä, joten olisin hieno sisällä. Silmä takana varmisti, että minua ei enää taivutettu, kun seisin edessä kirkkaasti loistava merkki, joka lukee: ""Albornin Pawnshop!"" hitaammilla askeleilla, tulin uudelleen – tämä paikka oli enemmän peiton alla, koska Alborn ottaisi usein ihmisiä, jotka olivat muuttuneet ja pyyhkäisivät Paltricuksen. Kun avain oven, valot olivat sammuneet, mielenkiintoisia tarpeeksi – ei ollut Al. Ei pakolaisia. Mikään.","Eikö olekin hassua? Meillä on enää puolet työvoimastamme, muttemme silti kykene olemaan satuttamatta toisiamme. Kävelin nopeammin. Alin paikka oli nurkan takana, ja siellä olisin turvassa. Vilkaisin taakseni ja tarkistin, ettei minua seurattu enää. Edessäni oli kirkas ja hehkuva kyltti, jossa luki ""Albornin panttilainaamo!"" Hidastin tahtia ja menin sisälle. Paikka oli suojaisa, koska Alborn päästi usein sisälle henkilöitä, jotka kärsivät mutaatiosta ja olivat livahtaneet Paltricukseen. Avasin oven ja huomasin, että paikka oli pimeänä. Kiinnostavaa, Al ei ollut paikalla. Ei myöskään pakolaisia tai ketään muutakaan. Jokin oli vialla."
alirezamsh/small100,fi,These good quality stickers are about 50p each. They'll cost the same again to post. And way more in my own time to individually package and send them.,Nämä laadukkaat kiinnittimet ovat noin 50p jokainen. Ne maksaa sama uudelleen lähettää. Ja paljon enemmän omassa ajallani yksilöllisesti pakata ja lähettää ne.,"Nämä hyvälaatuiset tarrat ovat 50 penniä kappaleelta. Niiden postittaminen maksaa saman verran. Ja paljon enemmän omaa aikaani, jos paketoin ja lähetän ne."
alirezamsh/small100,fi,So the challenges in this are already showing themselves. I'm likely going to have a VERY difficult time getting a medical clearance due to the FAA's stance on certain medications.,"Joten haasteet tässä ovat jo osoittavat itsensä. Minulla on todennäköisesti erittäin vaikeaa aikaa saada lääketieteellinen selvitys, koska FAA: n asenne tiettyihin lääkkeisiin.",Lentämisen haasteet alkavat jo näyttäytyä. Minun on luultavasi ERITTÄIN vaikea saada lääkärintodistus FAA:n tiettyjä lääkkeitä koskevan kannan vuoksi.
alirezamsh/small100,fi,And just under the wire basically someone actually beat Trimming the Herbs! Really impressive.,Ja juuri alla langetta pohjimmiltaan joku todella lyö leikkaamalla yrttejä! Todella vaikuttava.,Ja viime hetkellä joku suoritti Trimming the Herbsin! Todella vaikuttavaa.
alirezamsh/small100,fi,Yea so I flew this today.,Niinpä nyt olen lentänyt.,Lensin tällä tänään.
alirezamsh/small100,fi,"So my dad can't give me rides to work. And for me, work is about 27 miles away. So there and back would be nearly a $100 a day with Uber. I haven't looked at Lyft. I could have, I guess, that makes sense. But I didn't have rental on my auto insurance, so that's my fault. So I guess I could have tried to do that and get that set up and tried to get a rental while I was down and out of a car. But even then, a rental wouldn't cover seven days. I'm going to sneeze, hold on. That sneeze sucked.","Joten isäni ei voi antaa minulle ratsastuksia työskennellä. Ja minulle työ on noin 27 mailia. Joten siellä ja takaisin olisi lähes 100 dollaria päivässä Uberin kanssa. En ole katsonut Lyftin. Voisin olla, luulen, että on järkevää. Mutta minulla ei ollut autonvakuutus, joten se on minun vikaani. Joten luulen, että voisin yrittää tehdä niin ja saada se asetettu ja yritti saada vuokraus, kun olin alas ja ulos autosta. Mutta vielä silloin vuokraus ei kattaisi seitsemän päivää. Minä menen lumen, pidä kiinni. Se lumen imeytyi.","Isäni ei voi viedä minua töihin. Työpaikkani on noin 27 mailin päässä. Sinne ja takaisin maksaisi melkein 100 $ Uberilla. En ole katsonut Lyftiä. Voisin, se voisi olla ok. Mutta autovakuutukseni ei sisällä vuokrausta, joten se oli minun vikani. Olisin voinut kokeilla sitä ja järjestää sen ja yrittää saada vuokra-auton, kun olin ilman autoa. Mutta silti vuokra-auto ei kattaisi seitsemää päivää. Aivastan, odota. Tuo aivastus oli syvältä."
alirezamsh/small100,fi,Saturday Cont:,Lauantainen tili:,Lauantai jatkuu:
alirezamsh/small100,fi,"Rosendale, a member of the hard-right Freedom Caucus, was one of the individuals who derailed the Wednesday votes. He views the top line number in Johnson's deal as being too high and as doing too little to cut the $34 trillion national debt.","Rosendale, äärioikeiston Freedom Caucusin jäsen, oli yksi yksilöistä, jotka torjuivat keskiviikkona ääniä. Hän katsoo Johnsonin sopimuksen huippuluokan olevan liian korkea ja teki liian vähän leikkaamaan 34 triljoonaa dollaria kansallista velkaa.","Äärioikeistolaisen Freedom Caucus -ryhmän jäsen Rosendale oli yksi niistä, jotka torpedoivat keskiviikon äänestyksiä. Hän pitää Johnsonin sopimuksen ylärajaa liian korkeana ja katsoo, ettei se leikkaa tarpeeksi 34 biljoonan dollarin valtionvelasta."
alirezamsh/small100,fi,"South Wales four-piece The Now are proud to release their debut album, Too Hot To Handle, via True Music, and Callum joins me now. How are you doing, Callum? How's it going? Yeah, all good. Good, yourself? Yes, I'm very good. Thank you. It's a privilege to speak to yourselves because I've been listening to your music quite a lot since 2023. So I'm just loving the music, and I think it's something that we definitely need in the charts these days.","South Walesin neljä kappaletta The Now ovat ylpeitä julkaisemasta debüttialbuminsa, Too Hot To Handle, True Musicin kautta, ja Callum liittyy minuun nyt. Miten teet, Callum? Miten se menee? Kyllä, kaikki hyvin. Hyvä, itse? Kyllä, olen erittäin hyvä. Kiitos. Se on etuoikeus puhua itselleni, koska olen kuunnellut musiikkia melko paljon vuodesta 2023. Joten rakastan musiikkia, ja mielestäni se on jotain, jota ehdottomasti tarvitsemme näinä päivinä kaavioissa.","Eteläwalesiläinen neljän henkilön bändi The Now julkaisevat ylpeänä debyyttialbuminsa Too Hot To Handlen True Musicin kautta, ja Callum on nyt kanssani. Mitä kuuluu, Callum? Miten menee? Joo, hyvää. Hyvin, entä sinulle? Kyllä, voin hyvin. Kiitos. On kunnia puhua kanssanne, koska olen kuunnellut musiikkianne aika paljon vuodesta 2023 lähtien. Rakastan musiikkia, ja uskon, että tarvitsemme sitä listoilla näinä päivinä."
alirezamsh/small100,fi,"The results are in and, drum roll, please, it's completely consistent with my family history. 89.9% British and Irish with most of that concentrated in the scottish borders, western Ireland, Wales, and cornwall. It doesn't show much breton tho so either they're so close to cornish they don't show as different in me or my breton family wasn't originally from there.","Tulokset ovat ja, drum roll, ole hyvä, se on täysin yhdenmukainen perhehistoriani. 89.9% brittiläinen ja irlantilainen, jossa suurin osa keskittynyt Skotlannin rajalla, Länsi-Irlannin, Walesin ja maissi. Se ei näytä paljon bretoni tho joten joko ne ovat niin lähellä cornish he eivät näytä niin erilainen minussa tai bretoni perhe ei ollut alun perin.","Tulokset ovat saapuneet, ja, rummunpärinää kiitos, ne ovat täysin johdonmukaisia perhehistoriani kanssa. 89,9 % brittiläinen ja irlantilainen, josta suurin osa on Skotlannin rajalta, Länsi-Irlannista, Walesista ja Cornwallista. Siinä ei tosin näy kovinkaan paljon bretagnelaisuutta, joten joko he ovat niin samankaltaisia kuin cornwallilaiset, ettei se näy erikseen minussa, tai bretoniperheeni ei ollut alun perin kotoisin Bretagnesta."
alirezamsh/small100,fr,"However, Tenuk and Kayel quickly realized they weren't alone. A second dark creature shot out from beneath them, and Tenuk only just managed to avoid a collision.","Cependant, Tenuk et Kayel se sont rapidement rendus compte qu'ils n'étaient pas seuls. Une seconde créature sombre a été tirée sous eux, et Tenuk a juste réussi à éviter une collision.","Cependant, Tenuk et Kayel réalisèrent rapidement qu'ils n'étaient pas seuls. Une deuxième créature sombre surgit d'en bas, et Tenuk réussit à l'éviter de justesse."
